<?xml version="1.0" encoding="UTF-8" ?>
<!DOCTYPE configuration PUBLIC "-//mybatis.org//DTD Config 3.0//EN" "http://mybatis.org/dtd/mybatis-3-config.dtd">

<configuration>
	<!-- CREATE SCHEMA `uprep` ; -->
	<environments default="development_integrated">
		
		<environment id="default_uprep_datasource">
			<transactionManager type="JDBC" />
			<dataSource type="POOLED">
				<property name="driver" value="com.mysql.jdbc.Driver" />
				<property name="url" value="jdbc:mysql://localhost:3306/uprep" />
				<property name="username" value="root" />
				<property name="password" value="root" />
				<property name="defaultAutoCommit" value="false" />
				<property name="poolMaximumActiveConnections" value="1000"/>  
				<property name="poolMaximumIdleConnections" value="20"/>  
				<property name="poolMaximumCheckoutTime" value="20000"/>  
				<property name="poolPingEnabled" value="true"/>  
				<property name="poolPingQuery" value="select 1 from dual"/>
				<property name="poolPingConnectionsNotUsedFor" value="3600"/>  
				<property name="poolTimeToWait" value="30000"/>  
			</dataSource>
		</environment>
		
		<environment id="uprep_datasource">
			<transactionManager type="JDBC" />
			<dataSource type="POOLED">
				<property name="driver" value="com.mysql.jdbc.Driver" />
				<property name="url" value="${mysql.db.url}" />
				<property name="username" value="${mysql.db.username}" />
				<property name="password" value="${mysql.db.password}" />
				<property name="defaultAutoCommit" value="false" />
				<property name="poolMaximumActiveConnections" value="1000"/>  
				<property name="poolMaximumIdleConnections" value="20"/>  
				<property name="poolMaximumCheckoutTime" value="20000"/>  
				<property name="poolPingEnabled" value="true"/>  
				<property name="poolPingQuery" value="select 1"/>
				<property name="poolPingConnectionsNotUsedFor" value="3600"/>  
				<property name="poolTimeToWait" value="30000"/>
			</dataSource>
		</environment>
		
	</environments>
</configuration>